{
  "absolute_runtime_path_in_canonical_identity_count": 0,
  "artifact_bindings": {
    "c0_canonical_summary_sha256": "26f2e23a20e08223a001514558fa69f6298b6af0e761d379393bb99825db6689",
    "c0_contract_record_sha256": "5e229bf31aa9724e9d67c3675c1e99cf7454172e19a263ca8a45401993034a04",
    "c0a_canonical_summary_sha256": "831046b52005bdc7403015363c976bff72a36778a0f6186b2a437da805aecb61",
    "c0a_correction_record_sha256": "ebc929aa3f1fe06671bd2a46871c5abad70c01d7cc8a443026be7b51a8336a9c",
    "c1_canonical_summary_sha256": "6030142b3077b169734c341c119e8203068b5852b03e55efec89049649c1dcd0",
    "effective_acquisition_contract_identity_sha256": "c2690e8351b0d223d0ff073e0b14c3fea1b7792a83e81503ecda623cd740580d",
    "provisional_dataset_binding_sha256": "d4cfb61def187ed5b9613b868356fe3a90f4f0c7ce88357863be4d0b7e930991",
    "raw_intake_manifest_canonical_sha256": "479ea83c1293e1d809038f3e1dca9f8c0c6aeb24032dbfefc80d37a0aae1e7ea",
    "source_evidence_manifest_canonical_sha256": "25f0009644c5f90704b6f63f08142a26fd1895fed24dc4fed311ef222d4ad369",
    "strategy_content_sha256": "0e72b1559f5416981c2db887f9c53a0bfbb66bada226250a064377b2b9fadaa2",
    "strategy_git_blob_sha1": "da448295ac3bd443b376e1ce51a8e411de3c7245"
  },
  "canonical_summary_sha256": "a6dea767d6f04d6917d07bc22be44d26bb1a32a587662119cf9eb7e6aa4bd6b2",
  "checkpoint": "FR-Phase-C2",
  "conclusions": {
    "accepted_official_broker_gap_count": 0,
    "accepted_same_server_session_gap_count": 0,
    "analysis_internal_gap_interval_count": 126,
    "analysis_internal_unverified_gap_interval_count": 126,
    "analysis_row_count": 2904,
    "broker_history_completeness": "NOT_PROVEN",
    "contracted_right_buffer_row_count": 111,
    "detector_execution": "NOT_AUTHORIZED",
    "duplicate_conflicting_count": 0,
    "duplicate_identical_count": 0,
    "event_generation": "NOT_AUTHORIZED",
    "evidence_filename_count": 4,
    "evidence_unique_content_count": 3,
    "exact_source_identity": "VERIFIED",
    "gap_interval_count": 148,
    "holdout_status": "NOT_CLAIMED",
    "invalid_h1_alignment_count": 0,
    "invalid_timestamp_count": 0,
    "negative_spread_count": 0,
    "negative_tick_volume_count": 0,
    "negative_volume_count": 0,
    "next_allowed_scope": "FR_PHASE_C3_INDEPENDENT_DATASET_VALIDATION_AUDIT_AND_FREEZE_ONLY",
    "nominal_missing_hour_count": 1626,
    "non_finite_price_count": 0,
    "non_positive_price_count": 0,
    "ohlc_consistency_error_count": 0,
    "order_logic": "NOT_APPROVED",
    "original_ordering": "PASS",
    "out_of_sample_status": "NOT_CLAIMED",
    "outcome_execution": "NOT_AUTHORIZED",
    "performance": "NOT_EVALUATED",
    "pre_analysis_surplus_row_count": 0,
    "profitability": "NOT_CLAIMED",
    "raw_artifact_hash": "VERIFIED",
    "raw_artifact_original_bytes": "UNCHANGED",
    "requested_leading_boundary_status": "INCOMPLETE_LEADING_COVERAGE",
    "requested_trailing_boundary_status": "OBSERVED_OVERSHOOT",
    "right_buffer_status": "PASS",
    "right_buffer_valid_row_count": 482,
    "robustness": "NOT_ESTABLISHED",
    "strategy_edge": "NOT_ESTABLISHED",
    "strategy_file": "UNCHANGED",
    "structural_parse": "PASS",
    "surplus_post_contract_buffer_row_count": 371
  },
  "dataset_separation": {
    "broker_history_completeness_established": false,
    "comparison_basis": "IMMUTABLE_SHA256_ONLY",
    "fj_source_sha256": [
      "bbe0c3b83439dbd223ff64f4e6fa75af84981befff3482cb00161936b56bd468",
      "883f5076cdc6ef6c30caf8e995dd7e33f63e7f50e9e2a9f91f77d206ffbd4f0a",
      "368ce15fa4225c14bc1513d108ec75d1ab49274b82208b36de03b1cbdc92195b"
    ],
    "fq_source_sha256": [
      "7864a86a927a44b87fdba0ac088a2e24576a64a73e99079fa5660fd7df5efccc",
      "3aa00fbe2804a60ab88ab1e450027ee7b724de2463c576e0ed511658521fd2a5",
      "dc6193712acf45e4830c63705262df3605713514f5a76dd989e14f9d4dc2213a"
    ],
    "holdout_status_established": false,
    "out_of_sample_status_established": false,
    "performance_independence_established": false,
    "phase_c_raw_sha256": "69aa7e16d4d3e54bfe8e0aa3ce4c5d61bbd0fcaefb45050341304681b3766f92",
    "status": "DISTINCT_RAW_ARTIFACT_IDENTITY",
    "strategy_independence_established": false
  },
  "dataset_validation_identity_sha256": "44445d40461a1590d1e990116ddf7fa7c624483eef85eec8caf4e0fc6f949271",
  "decision": "FR_PHASE_C2_PASS_DATASET_VALIDATED_WITH_LIMITATIONS",
  "decision_class": "PASS_DATASET_VALIDATED_WITH_LIMITATIONS",
  "determinism": {
    "absolute_paths_excluded": true,
    "controlled_relocation_runs": 1,
    "identical_boundary_results": true,
    "identical_canonical_summaries_and_hashes": true,
    "identical_decision": true,
    "identical_gap_ids_and_ordering": true,
    "identical_gap_inventory_hash": true,
    "identical_parsed_row_identity": true,
    "identical_row_counts": true,
    "mismatch_counters": {
      "boundary_mismatches": 0,
      "canonical_hash_mismatches": 0,
      "decision_mismatches": 0,
      "gap_inventory_mismatches": 0,
      "parsed_row_identity_mismatches": 0,
      "raw_pre_post_hash_mismatches": 0,
      "raw_pre_post_size_mismatches": 0,
      "relocation_byte_mismatches": 0,
      "row_count_mismatches": 0
    },
    "normal_validation_runs": 2,
    "temporary_artifacts_deleted": true,
    "temporary_copy_bytes_preserved": true
  },
  "execution_status": "PASS",
  "limitations": [
    "REQUESTED_LEADING_BOUNDARY_INCOMPLETE",
    "ANALYSIS_LEADING_BOUNDARY_INCOMPLETE",
    "ANALYSIS_INTERNAL_UNVERIFIED_GAPS",
    "HISTORICAL_SESSION_EVIDENCE_EFFECTIVE_RANGE_MISSING",
    "BROKER_HISTORY_COMPLETENESS_NOT_PROVEN",
    "SURPLUS_POST_CONTRACT_BUFFER_PRESENT"
  ],
  "negative_tests": {
    "passed": 41,
    "required": 41,
    "results": {
      "absolute_operator_path_or_sensitive_data_stored": "PASS",
      "broker_history_completeness_claimed": "PASS",
      "changed_c0_c0a_c1_identity": "PASS",
      "changed_effective_or_provisional_dataset_identity": "PASS",
      "conflicting_duplicate_timestamp_accepted": "PASS",
      "current_screenshot_treated_as_dated_historical_evidence": "PASS",
      "dataset_described_as_clean_despite_retained_limitation": "PASS",
      "detector_event_outcome_or_statistics_executed": "PASS",
      "dukascopy_sibling_mt5_or_network_access": "PASS",
      "duplicate_image_content_counted_as_independent_evidence": "PASS",
      "existing_repository_file_modified": "PASS",
      "header_or_column_order_changed": "PASS",
      "high_low_consistency_error_accepted": "PASS",
      "holdout_or_out_of_sample_claimed": "PASS",
      "identical_duplicate_timestamp_accepted_as_clean": "PASS",
      "insufficient_buffer_accepted": "PASS",
      "malformed_date_or_time_accepted": "PASS",
      "missing_or_extra_field_accepted": "PASS",
      "missing_rows_interpolated_or_reconstructed": "PASS",
      "negative_tickvol_vol_or_spread_accepted": "PASS",
      "non_finite_ohlc_accepted": "PASS",
      "non_h1_timestamp_alignment_accepted": "PASS",
      "non_positive_ohlc_accepted": "PASS",
      "out_of_order_rows_silently_sorted": "PASS",
      "pattern_label_treated_as_historical_closure_proof": "PASS",
      "plain_gold_accepted_instead_of_gold_hash": "PASS",
      "pr_created": "PASS",
      "profitability_edge_robustness_or_readiness_claimed": "PASS",
      "raw_byte_size_mismatch": "PASS",
      "raw_evidence_committed": "PASS",
      "raw_row_count_mismatch": "PASS",
      "raw_sha256_mismatch": "PASS",
      "requested_leading_shortfall_ignored": "PASS",
      "requested_overshoot_added_to_analysis_window": "PASS",
      "right_buffer_row_used_as_event_row": "PASS",
      "source_file_modified_or_repaired": "PASS",
      "strategy_indicator_or_parameter_modified": "PASS",
      "tp_sl_lot_cost_cash_pl_or_order_simulation": "PASS",
      "unverified_gap_silently_cleared": "PASS",
      "wrong_branch_head_or_origin_alignment": "PASS",
      "wrong_server_symbol_or_timeframe": "PASS"
    }
  },
  "output_hashes": {
    "dataset_validation_decision_file_sha256": "c0f19ce55d4bd28ebd474aa80865bee4b2d9e6a44236d2c2762377a6a37b7c43",
    "dataset_validation_decision_record_sha256": "a9c42e6d1a5fd17fd485e230bcb3cd1bc46141c1d0d7c5a1ec1082760e689c4c",
    "gap_inventory_canonical_sha256": "5ee7f77c18ee6fac5a8793e2f667a7f0c44ddea20f3fa750d31122d528cc1688",
    "gap_inventory_file_sha256": "b16d35e730c4c760982198d250e403f46255a06bb5a89383da1b4aa55113184d",
    "row_structural_validation_summary_file_sha256": "117096f6583e162eec5747d91934056965cb5b0b23b1ebc1c2e48e9775951aa0",
    "timeline_boundary_validation_summary_file_sha256": "60ae7485542610ad844fd0ccb7f3eb3f944495290e2f5e6f9b45807e0e9c7f88"
  },
  "prohibited_counters": {
    "absolute_operator_paths_stored": 0,
    "aggregation_runs": 0,
    "cost_cash_pl_order_simulations": 0,
    "credentials_stored": 0,
    "detector_runs": 0,
    "docs_fixtures_raw_normalized_staging_created": 0,
    "dukascopy_sibling_mt5_network_accesses": 0,
    "event_generation_runs": 0,
    "external_artifact_mutations": 0,
    "fq_remediation_resumptions": 0,
    "interpolated_reconstructed_or_synthetic_rows": 0,
    "lot_sizing_designs": 0,
    "outcome_runs": 0,
    "pr_creations": 0,
    "profitability_edge_robustness_readiness_claims": 0,
    "raw_evidence_repository_copies": 0,
    "source_sort_repair_deduplication_runs": 0,
    "statistics_runs": 0,
    "strategy_indicator_parameter_modifications": 0,
    "timezone_conversions": 0,
    "tp_sl_designs": 0
  },
  "row_structural_validation": {
    "canonical_record_sha256": "f30d81d0becee7fed7d589ce5d7b19aac4758b9ab19dc12f3a968c9af743a0e5",
    "error_counts": {
      "blank_embedded_data_row_count": 0,
      "duplicate_conflicting_count": 0,
      "duplicate_identical_count": 0,
      "invalid_date_count": 0,
      "invalid_h1_alignment_count": 0,
      "invalid_time_count": 0,
      "invalid_timestamp_count": 0,
      "negative_spread_count": 0,
      "negative_tick_volume_count": 0,
      "negative_volume_count": 0,